{
  "$schema": "https://json-schema.org/draft/2020-12/schema",
  "$id": "https://singularityrd.example/schemas/aidr-native-support-matrix-v1.json",
  "title": "Singularity AIDR native host support matrix",
  "description": "Published structural contract for deploy/native/support-matrix.json. The normative validator is validateMatrix() in deploy/native/run-support-matrix.mjs: this schema is never loaded at run time, never decides a release, and deploy/native/run-support-matrix.test.mjs asserts that its exact property sets and field constraints agree with the validator constants. Cross-row connector coverage, interception vocabulary membership, evidence file existence and digest checks remain runtime checks.",
  "type": "object",
  "additionalProperties": false,
  "required": [
    "schemaVersion",
    "kind",
    "reviewedAt",
    "decision",
    "decisionMeaning",
    "soldConnectorScope",
    "soldPlatformScope",
    "soldArchitectureScope",
    "soldDeploymentProfiles",
    "interceptionPointVocabulary",
    "rows",
    "residual"
  ],
  "properties": {
    "$schema": { "type": "string" },
    "schemaVersion": { "const": 1 },
    "kind": { "const": "aidr-native-support-matrix" },
    "reviewedAt": {
      "type": "string",
      "pattern": "^\\d{4}-\\d{2}-\\d{2}$",
      "description": "Date the advertised scope was last reviewed by a human."
    },
    "decision": {
      "const": "NO-GO",
      "description": "A support matrix records scope, not success: it stays NO-GO until every row has named real-host acceptance."
    },
    "decisionMeaning": { "type": "string", "minLength": 1, "pattern": "\\S" },
    "soldConnectorScope": {
      "type": "array",
      "minItems": 1,
      "items": { "type": "string", "minLength": 1, "pattern": "\\S" }
    },
    "soldPlatformScope": {
      "type": "array",
      "minItems": 1,
      "items": { "enum": ["windows", "linux", "macos"] }
    },
    "soldArchitectureScope": {
      "type": "array",
      "minItems": 1,
      "items": { "enum": ["x64", "arm64"] }
    },
    "soldDeploymentProfiles": {
      "type": "array",
      "minItems": 1,
      "items": { "type": "string", "minLength": 1, "pattern": "\\S" }
    },
    "interceptionPointVocabulary": {
      "type": "array",
      "minItems": 1,
      "items": { "type": "string", "minLength": 1, "pattern": "\\S" }
    },
    "rows": {
      "type": "array",
      "minItems": 1,
      "items": { "$ref": "#/$defs/row" }
    },
    "residual": {
      "type": "array",
      "items": { "$ref": "#/$defs/residual" }
    }
  },
  "$defs": {
    "sha256": { "type": "string", "pattern": "^[0-9a-f]{64}$" },
    "evidence": {
      "type": "object",
      "additionalProperties": false,
      "required": ["path", "sha256"],
      "properties": {
        "path": { "type": "string", "minLength": 1, "pattern": "\\S" },
        "sha256": { "$ref": "#/$defs/sha256" }
      }
    },
    "row": {
      "type": "object",
      "additionalProperties": false,
      "required": [
        "connector",
        "hostBinary",
        "hostBinaryEnvOverride",
        "interceptionPoint",
        "outputInterceptionPoint",
        "tamperResistance",
        "supportedPlatforms",
        "supportedArchitectures",
        "supportedContexts",
        "installPath",
        "uninstallPath",
        "supportOwnerRole",
        "knownBypasses",
        "unobservedActions",
        "acceptanceEvidence"
      ],
      "properties": {
        "connector": { "type": "string", "minLength": 1, "pattern": "\\S" },
        "hostBinary": {
          "oneOf": [{ "type": "string", "minLength": 1, "pattern": "\\S" }, { "type": "null" }]
        },
        "hostBinaryEnvOverride": {
          "oneOf": [{ "type": "string", "pattern": "^[A-Z][A-Z0-9_]*$" }, { "type": "null" }]
        },
        "versionArgs": {
          "type": "array",
          "minItems": 1,
          "items": { "type": "string", "minLength": 1, "pattern": "\\S" }
        },
        "interceptionPoint": { "type": "string", "minLength": 1, "pattern": "\\S" },
        "outputInterceptionPoint": {
          "oneOf": [{ "type": "string", "minLength": 1, "pattern": "\\S" }, { "type": "null" }]
        },
        "tamperResistance": { "type": "string", "minLength": 1, "pattern": "\\S" },
        "supportedPlatforms": {
          "type": "array",
          "minItems": 1,
          "items": { "enum": ["windows", "linux", "macos"] }
        },
        "supportedArchitectures": {
          "type": "array",
          "minItems": 1,
          "items": { "enum": ["x64", "arm64"] }
        },
        "supportedContexts": {
          "type": "array",
          "minItems": 1,
          "items": { "enum": ["user", "service"] }
        },
        "installPath": {
          "type": "array",
          "items": { "type": "string", "minLength": 1, "pattern": "\\S" }
        },
        "uninstallPath": {
          "type": "array",
          "items": { "type": "string", "minLength": 1, "pattern": "\\S" }
        },
        "supportOwnerRole": { "type": "string", "minLength": 3, "pattern": "\\S" },
        "knownBypasses": {
          "type": "array",
          "items": { "type": "string", "minLength": 1, "pattern": "\\S" }
        },
        "unobservedActions": {
          "type": "array",
          "items": { "type": "string", "minLength": 1, "pattern": "\\S" }
        },
        "acceptanceEvidence": {
          "type": "array",
          "items": { "$ref": "#/$defs/evidence" }
        }
      }
    },
    "residual": {
      "type": "object",
      "additionalProperties": false,
      "required": ["id", "description", "ownerRole", "requiredInput", "acceptanceCommand", "acceptanceEvidence"],
      "properties": {
        "id": { "type": "string", "minLength": 1, "pattern": "\\S" },
        "description": { "type": "string", "minLength": 1, "pattern": "\\S" },
        "ownerRole": { "type": "string", "minLength": 1, "pattern": "\\S" },
        "requiredInput": { "type": "string", "minLength": 1, "pattern": "\\S" },
        "acceptanceCommand": { "type": "string", "minLength": 1, "pattern": "\\S" },
        "acceptanceEvidence": {
          "type": "array",
          "items": { "$ref": "#/$defs/evidence" }
        }
      }
    }
  }
}
